{
  "contract": "sdlc-ai-spec/runtime-invocation/v1",
  "operation": "create",
  "project_root": "<absolute-fixture-directory>",
  "artifact_reference": null,
  "inputs": {
    "context": {
      "summary": "文档结构示例；实际项目事实必须另行采集。",
      "project_identity": {
        "project_name": {
          "value": "Example documents",
          "basis": "confirmed",
          "basis_references": [
            "EVD-001"
          ]
        },
        "purpose": {
          "value": "Demonstrate input structure",
          "basis": "confirmed",
          "basis_references": [
            "EVD-001"
          ]
        },
        "boundary": {
          "value": "Example document fixture only",
          "basis": "confirmed",
          "basis_references": [
            "EVD-001"
          ]
        },
        "primary_resource_reference": {
          "value": "RSC-001",
          "basis": "confirmed",
          "basis_references": [
            "EVD-001"
          ]
        },
        "authoritative_references": {
          "value": "None",
          "basis": "confirmed",
          "basis_references": [
            "EVD-001"
          ]
        }
      },
      "resources": [
        {
          "id": "RSC-001",
          "type": "document-set",
          "name": "Example document",
          "role": "primary",
          "locator": "inline:SUP-001",
          "baseline_reference": "sha256:6df02fff2deb7f2e87114b282338598dccd4503e70ac325d9ac5cfc68890ba9c",
          "basis": "observed",
          "basis_references": [
            "EVD-001"
          ]
        }
      ],
      "technologies": {
        "none": {
          "basis": "confirmed",
          "basis_references": [
            "EVD-001"
          ]
        }
      },
      "engineering_entries": {
        "none": {
          "basis": "confirmed",
          "basis_references": [
            "EVD-001"
          ]
        }
      },
      "components": {
        "none": {
          "basis": "confirmed",
          "basis_references": [
            "EVD-001"
          ]
        }
      },
      "rules": {
        "none": {
          "basis": "confirmed",
          "basis_references": [
            "EVD-001"
          ]
        }
      },
      "environments": {
        "none": {
          "basis": "confirmed",
          "basis_references": [
            "EVD-001"
          ]
        }
      },
      "constraints": {
        "none": {
          "basis": "confirmed",
          "basis_references": [
            "EVD-001"
          ]
        }
      },
      "exceptions": []
    },
    "evidence": [
      {
        "id": "EVD-001",
        "type": "observation",
        "supports_references": [
          "CTX-G-002",
          "CTX-G-003",
          "CTX-G-004"
        ],
        "source_or_producer": "bundled example fixture",
        "reference": "example.txt",
        "integrity_or_digest": "sha256:6df02fff2deb7f2e87114b282338598dccd4503e70ac325d9ac5cfc68890ba9c",
        "produced_at": "2026-09-08T00:00:00Z",
        "sensitivity_or_access": "public fixture"
      }
    ],
    "supporting_members": [
      {
        "member_id": "SUP-001",
        "canonical_name": "example.txt",
        "media_type": "text/plain",
        "purpose": "illustrative bytes",
        "content": "Example document fixture. This record is not a user approval or production fact.\n"
      }
    ]
  },
  "confirmations": [
    {
      "type": "project_boundary",
      "value": "Example document fixture only",
      "authority_reference": "EVD-001"
    }
  ],
  "options": {
    "dry_run": true
  }
}
